A1: Inventory | I1: ¹êÅç³ø¼o | L1: Stage | M1: Daily Target MVMT | N1: ¬Q¤é_WIP | O1: ¤µ¤é_WIP | P1: Total_Move | Q1: Hold_WIP | R1: Scrap | S1: Rework | T1: _WIP | U1: _Move | V1: 430A1F003_WIP | W1: 430A1F003_Move | X1: 500B1F003_WIP | Y1: 500B1F003_Move | Z1: 500C1F003_WIP | AA1: 500C1F003_Move | AB1: 700D1F004_WIP | AC1: 700D1F004_Move | AD1: 700J1F003_WIP | AE1: 700J1F003_Move | AF1: 700J1F003-R_WIP | AG1: 700J1F003-R_Move | AH1: 700K1F003_WIP | AI1: 700K1F003_Move | AJ1: 700L1F004_WIP | AK1: 700L1F004_Move | AL1: 900A1F003_WIP | AM1: 900A1F003_Move | AN1: 900A1F003-R_WIP | AO1: 900A1F003-R_Move | AP1: 970B1F008_WIP | AQ1: 970B1F008_Move | AR1: AZBA1F003_WIP | AS1: AZBA1F003_Move | AT1: AZBB1F003_WIP | AU1: AZBB1F003_Move | AV1: BCFA1F003_WIP | AW1: BCFA1F003_Move | AX1: BCFA1F003-R_WIP | AY1: BCFA1F003-R_Move | AZ1: BCZA1F003_WIP | BA1: BCZA1F003_Move | BB1: BCZA1F003-R_WIP | BC1: BCZA1F003-R_Move | BD1: BCZB1F003_WIP | BE1: BCZB1F003_Move | BF1: BCZB1F003-R_WIP | BG1: BCZB1F003-R_Move | BH1: BCZC1F003_WIP | BI1: BCZC1F003_Move
A2: Unpack | C2: Rework | I2: 4 | L2: Unpack | M2: 3500 | N2: 1455 | O2: 1071 | P2: 788 | Q2: 87 | R2: 20 | S2: 0
A3: EXG.5µL½¤ | B3: 106 | C3: EXG.5 | D3: 559 | L3: BM_Line | M3: 3500 | N3: 459 | O3: 389 | P3: 1323 | Q3: 9 | R3: 1 | S3: 18 | T3: 0 | U3: 0 | V3: 9 | W3: 0 | X3: 0 | Y3: 0 | Z3: 0 | AA3: 0 | AB3: 0 | AC3: 0 | AD3: 0 | AE3: 0 | AF3: 0 | AG3: 0 | AH3: 0 | AI3: 0 | AJ3: 0 | AK3: 0 | AL3: 0 | AM3: 0 | AN3: 0 | AO3: 0 | AP3: 0 | AQ3: 0 | AR3: 0 | AS3: 448 | AT3: 0 | AU3: 0 | AV3: 0 | AW3: 0 | AX3: 0 | AY3: 0 | AZ3: 363 | BA3: 875 | BB3: 17 | BC3: 0 | BD3: 0 | BE3: 0 | BF3: 0 | BG3: 0 | BH3: 0 | BI3: 0
A4: EXG.63µL½¤ | B4: 0 | C4: EXG.63 | D4: 247 | L4: R_Line | M4: 3500 | N4: 84 | O4: 216 | P4: 1088 | Q4: 57 | R4: 0 | S4: 24 | T4: 0 | U4: 0 | V4: 0 | W4: 0 | X4: 0 | Y4: 0 | Z4: 0 | AA4: 0 | AB4: 0 | AC4: 0 | AD4: 0 | AE4: 0 | AF4: 0 | AG4: 0 | AH4: 0 | AI4: 0 | AJ4: 0 | AK4: 0 | AL4: 0 | AM4: 0 | AN4: 0 | AO4: 0 | AP4: 52 | AQ4: 0 | AR4: 0 | AS4: 464 | AT4: 0 | AU4: 0 | AV4: 0 | AW4: 0 | AX4: 0 | AY4: 0 | AZ4: 164 | BA4: 624 | BB4: 0 | BC4: 0 | BD4: 0 | BE4: 0 | BF4: 0 | BG4: 0 | BH4: 0 | BI4: 0
A5: EXG.7µL½¤ | B5: 965 | C5: EXG.7 | D5: 600 | L5: B_Line | M5: 3500 | N5: 24 | O5: 84 | P5: 1004 | Q5: 0 | R5: 0 | S5: 22 | T5: 0 | U5: 0 | V5: 0 | W5: 0 | X5: 0 | Y5: 0 | Z5: 0 | AA5: 0 | AB5: 0 | AC5: 0 | AD5: 0 | AE5: 0 | AF5: 0 | AG5: 0 | AH5: 0 | AI5: 0 | AJ5: 0 | AK5: 0 | AL5: 0 | AM5: 0 | AN5: 0 | AO5: 0 | AP5: 0 | AQ5: 0 | AR5: 0 | AS5: 464 | AT5: 0 | AU5: 0 | AV5: 0 | AW5: 0 | AX5: 0 | AY5: 0 | AZ5: 84 | BA5: 540 | BB5: 0 | BC5: 0 | BD5: 0 | BE5: 0 | BF5: 0 | BG5: 0 | BH5: 0 | BI5: 0
A6: EXG.63¦³½¤ | B6: 0 | C6: ¡@ | D6: ¡@ | L6: G_Line | M6: 3500 | N6: 108 | O6: 250 | P6: 840 | Q6: 72 | R6: 0 | S6: 8 | T6: 0 | U6: 0 | V6: 0 | W6: 0 | X6: 0 | Y6: 0 | Z6: 0 | AA6: 0 | AB6: 0 | AC6: 0 | AD6: 0 | AE6: 0 | AF6: 0 | AG6: 0 | AH6: 0 | AI6: 0 | AJ6: 0 | AK6: 0 | AL6: 0 | AM6: 0 | AN6: 0 | AO6: 0 | AP6: 0 | AQ6: 0 | AR6: 0 | AS6: 478 | AT6: 0 | AU6: 0 | AV6: 0 | AW6: 0 | AX6: 0 | AY6: 0 | AZ6: 178 | BA6: 362 | BB6: 0 | BC6: 0 | BD6: 72 | BE6: 0 | BF6: 0 | BG6: 0 | BH6: 0 | BI6: 0
A7: EXG.7¦³½¤ | B7: 0 | C7: ¡@ | D7: ¡@ | L7: IF_Line | M7: 3000 | N7: 673 | O7: 145 | P7: 1047 | Q7: 0 | R7: 0 | S7: 24 | T7: 0 | U7: 0 | V7: 0 | W7: 0 | X7: 0 | Y7: 0 | Z7: 0 | AA7: 0 | AB7: 0 | AC7: 0 | AD7: 0 | AE7: 0 | AF7: 0 | AG7: 0 | AH7: 0 | AI7: 0 | AJ7: 0 | AK7: 0 | AL7: 0 | AM7: 0 | AN7: 0 | AO7: 0 | AP7: 0 | AQ7: 0 | AR7: 73 | AS7: 1047 | AT7: 0 | AU7: 0 | AV7: 0 | AW7: 0 | AX7: 0 | AY7: 0 | AZ7: 72 | BA7: 0 | BB7: 0 | BC7: 0 | BD7: 0 | BE7: 0 | BF7: 0 | BG7: 0 | BH7: 0 | BI7: 0
L8: IF_IT_Line | M8: 3000 | N8: 3 | O8: 309 | P8: 22 | Q8: 19 | R8: 0 | S8: 4 | T8: 0 | U8: 0 | V8: 0 | W8: 0 | X8: 0 | Y8: 0 | Z8: 0 | AA8: 0 | AB8: 0 | AC8: 0 | AD8: 0 | AE8: 0 | AF8: 0 | AG8: 4 | AH8: 0 | AI8: 0 | AJ8: 0 | AK8: 0 | AL8: 0 | AM8: 17 | AN8: 7 | AO8: 0 | AP8: 0 | AQ8: 0 | AR8: 0 | AS8: 0 | AT8: 0 | AU8: 0 | AV8: 0 | AW8: 0 | AX8: 12 | AY8: 0 | AZ8: 290 | BA8: 1 | BB8: 0 | BC8: 0 | BD8: 0 | BE8: 0 | BF8: 0 | BG8: 0 | BH8: 0 | BI8: 0
L9: OC_IPSLine | M9: 3000 | N9: 0 | O9: 0 | P9: 0 | Q9: 0 | R9: 0 | S9: 0 | T9: 0 | U9: 0 | V9: 0 | W9: 0 | X9: 0 | Y9: 0 | Z9: 0 | AA9: 0 | AB9: 0 | AC9: 0 | AD9: 0 | AE9: 0 | AF9: 0 | AG9: 0 | AH9: 0 | AI9: 0 | AJ9: 0 | AK9: 0 | AL9: 0 | AM9: 0 | AN9: 0 | AO9: 0 | AP9: 0 | AQ9: 0 | AR9: 0 | AS9: 0 | AT9: 0 | AU9: 0 | AV9: 0 | AW9: 0 | AX9: 0 | AY9: 0 | AZ9: 0 | BA9: 0 | BB9: 0 | BC9: 0 | BD9: 0 | BE9: 0 | BF9: 0 | BG9: 0 | BH9: 0 | BI9: 0
L10: ITO_Line | M10: 3000 | N10: 791 | O10: 235 | P10: 1582 | Q10: 0 | R10: 0 | S10: 0 | T10: 0 | U10: 0 | V10: 1 | W10: 0 | X10: 0 | Y10: 0 | Z10: 0 | AA10: 0 | AB10: 0 | AC10: 0 | AD10: 0 | AE10: 0 | AF10: 3 | AG10: 0 | AH10: 0 | AI10: 0 | AJ10: 0 | AK10: 0 | AL10: 14 | AM10: 0 | AN10: 0 | AO10: 0 | AP10: 0 | AQ10: 0 | AR10: 216 | AS10: 1582 | AT10: 0 | AU10: 0 | AV10: 0 | AW10: 0 | AX10: 0 | AY10: 0 | AZ10: 1 | BA10: 0 | BB10: 0 | BC10: 0 | BD10: 0 | BE10: 0 | BF10: 0 | BG10: 0 | BH10: 0 | BI10: 0
A11: Rework Out | L11: ITO2_Line | M11: 1500 | N11: 89 | O11: 0 | P11: 89 | Q11: 0 | R11: 0 | S11: 2 | T11: 0 | U11: 0 | V11: 0 | W11: 0 | X11: 0 | Y11: 0 | Z11: 0 | AA11: 0 | AB11: 0 | AC11: 0 | AD11: 0 | AE11: 0 | AF11: 0 | AG11: 0 | AH11: 0 | AI11: 0 | AJ11: 0 | AK11: 0 | AL11: 0 | AM11: 89 | AN11: 0 | AO11: 0 | AP11: 0 | AQ11: 0 | AR11: 0 | AS11: 0 | AT11: 0 | AU11: 0 | AV11: 0 | AW11: 0 | AX11: 0 | AY11: 0 | AZ11: 0 | BA11: 0 | BB11: 0 | BC11: 0 | BD11: 0 | BE11: 0 | BF11: 0 | BG11: 0 | BH11: 0 | BI11: 0
A12: PS_Rework_Out | B12: PS_Rework_L3 | C12: PS_Rework_Pack_Cst | D12: PS_Rework_Pack_PPBOX | L12: PS_Line | M12: 3400 | N12: 1726 | O12: 1613 | P12: 1782 | Q12: 83 | R12: 0 | S12: 3 | T12: 0 | U12: 0 | V12: 0 | W12: 0 | X12: 0 | Y12: 0 | Z12: 0 | AA12: 0 | AB12: 0 | AC12: 0 | AD12: 0 | AE12: 0 | AF12: 0 | AG12: 0 | AH12: 66 | AI12: 0 | AJ12: 0 | AK12: 0 | AL12: 0 | AM12: 1564 | AN12: 0 | AO12: 0 | AP12: 95 | AQ12: 0 | AR12: 1365 | AS12: 218 | AT12: 67 | AU12: 0 | AV12: 0 | AW12: 0 | AX12: 0 | AY12: 0 | AZ12: 0 | BA12: 0 | BB12: 0 | BC12: 0 | BD12: 0 | BE12: 0 | BF12: 18 | BG12: 0 | BH12: 2 | BI12: 0
A13: N/A | B13: N/A | C13: N/A | D13: N/A | L13: IS_Line | M13: 2000 | N13: 683 | O13: 517 | P13: 1512 | Q13: 30 | R13: 1 | S13: 0 | T13: 0 | U13: 0 | V13: 0 | W13: 0 | X13: 0 | Y13: 0 | Z13: 0 | AA13: 0 | AB13: 0 | AC13: 0 | AD13: 0 | AE13: 0 | AF13: 0 | AG13: 0 | AH13: 0 | AI13: 0 | AJ13: 6 | AK13: 0 | AL13: 269 | AM13: 1512 | AN13: 0 | AO13: 0 | AP13: 0 | AQ13: 0 | AR13: 218 | AS13: 0 | AT13: 0 | AU13: 0 | AV13: 0 | AW13: 0 | AX13: 0 | AY13: 0 | AZ13: 0 | BA13: 0 | BB13: 0 | BC13: 0 | BD13: 0 | BE13: 0 | BF13: 0 | BG13: 0 | BH13: 24 | BI13: 0
L14: IS_IT_Line | M14: 2500 | N14: 282 | O14: 0 | P14: 712 | Q14: 0 | R14: 2 | S14: 49 | T14: 0 | U14: 0 | V14: 0 | W14: 0 | X14: 0 | Y14: 0 | Z14: 0 | AA14: 0 | AB14: 0 | AC14: 0 | AD14: 0 | AE14: 0 | AF14: 0 | AG14: 0 | AH14: 0 | AI14: 0 | AJ14: 0 | AK14: 0 | AL14: 0 | AM14: 0 | AN14: 0 | AO14: 0 | AP14: 0 | AQ14: 0 | AR14: 0 | AS14: 0 | AT14: 0 | AU14: 0 | AV14: 0 | AW14: 0 | AX14: 0 | AY14: 712 | AZ14: 0 | BA14: 0 | BB14: 0 | BC14: 0 | BD14: 0 | BE14: 0 | BF14: 0 | BG14: 0 | BH14: 0 | BI14: 0
A15: ¡@ | B15: 2 | C15: 3622 | D15: ¡@ | L15: Finish | M15: 3000 | N15: 3551 | O15: 1208 | P15: 4721 | Q15: 972 | R15: 0 | S15: 16 | T15: 0 | U15: 0 | V15: 39 | W15: 0 | X15: 0 | Y15: 0 | Z15: 16 | AA15: 0 | AB15: 11 | AC15: 0 | AD15: 0 | AE15: 0 | AF15: 0 | AG15: 0 | AH15: 0 | AI15: 0 | AJ15: 0 | AK15: 58 | AL15: 0 | AM15: 1930 | AN15: 64 | AO15: 69 | AP15: 382 | AQ15: 0 | AR15: 0 | AS15: 0 | AT15: 0 | AU15: 0 | AV15: 461 | AW15: 2160 | AX15: 159 | AY15: 504 | AZ15: 29 | BA15: 0 | BB15: 0 | BC15: 0 | BD15: 0 | BE15: 0 | BF15: 0 | BG15: 0 | BH15: 47 | BI15: 0
L16: BM_OCLine | N16: 0 | O16: 0 | P16: 0 | Q16: 0 | R16: 0 | S16: 0 | T16: 0 | U16: 0 | V16: 0 | W16: 0 | X16: 0 | Y16: 0 | Z16: 0 | AA16: 0 | AB16: 0 | AC16: 0 | AD16: 0 | AE16: 0 | AF16: 0 | AG16: 0 | AH16: 0 | AI16: 0 | AJ16: 0 | AK16: 0 | AL16: 0 | AM16: 0 | AN16: 0 | AO16: 0 | AP16: 0 | AQ16: 0 | AR16: 0 | AS16: 0 | AT16: 0 | AU16: 0 | AV16: 0 | AW16: 0 | AX16: 0 | AY16: 0 | AZ16: 0 | BA16: 0 | BB16: 0 | BC16: 0 | BD16: 0 | BE16: 0 | BF16: 0 | BG16: 0 | BH16: 0 | BI16: 0
L17: R_OCLine | N17: 0 | O17: 0 | P17: 0 | Q17: 0 | R17: 0 | S17: 0 | T17: 0 | U17: 0 | V17: 0 | W17: 0 | X17: 0 | Y17: 0 | Z17: 0 | AA17: 0 | AB17: 0 | AC17: 0 | AD17: 0 | AE17: 0 | AF17: 0 | AG17: 0 | AH17: 0 | AI17: 0 | AJ17: 0 | AK17: 0 | AL17: 0 | AM17: 0 | AN17: 0 | AO17: 0 | AP17: 0 | AQ17: 0 | AR17: 0 | AS17: 0 | AT17: 0 | AU17: 0 | AV17: 0 | AW17: 0 | AX17: 0 | AY17: 0 | AZ17: 0 | BA17: 0 | BB17: 0 | BC17: 0 | BD17: 0 | BE17: 0 | BF17: 0 | BG17: 0 | BH17: 0 | BI17: 0
L18: B_OCLine | N18: 0 | O18: 0 | P18: 0 | Q18: 0 | R18: 0 | S18: 0 | T18: 0 | U18: 0 | V18: 0 | W18: 0 | X18: 0 | Y18: 0 | Z18: 0 | AA18: 0 | AB18: 0 | AC18: 0 | AD18: 0 | AE18: 0 | AF18: 0 | AG18: 0 | AH18: 0 | AI18: 0 | AJ18: 0 | AK18: 0 | AL18: 0 | AM18: 0 | AN18: 0 | AO18: 0 | AP18: 0 | AQ18: 0 | AR18: 0 | AS18: 0 | AT18: 0 | AU18: 0 | AV18: 0 | AW18: 0 | AX18: 0 | AY18: 0 | AZ18: 0 | BA18: 0 | BB18: 0 | BC18: 0 | BD18: 0 | BE18: 0 | BF18: 0 | BG18: 0 | BH18: 0 | BI18: 0
L19: G_OCLine | N19: 0 | O19: 0 | P19: 0 | Q19: 0 | R19: 0 | S19: 0 | T19: 0 | U19: 0 | V19: 0 | W19: 0 | X19: 0 | Y19: 0 | Z19: 0 | AA19: 0 | AB19: 0 | AC19: 0 | AD19: 0 | AE19: 0 | AF19: 0 | AG19: 0 | AH19: 0 | AI19: 0 | AJ19: 0 | AK19: 0 | AL19: 0 | AM19: 0 | AN19: 0 | AO19: 0 | AP19: 0 | AQ19: 0 | AR19: 0 | AS19: 0 | AT19: 0 | AU19: 0 | AV19: 0 | AW19: 0 | AX19: 0 | AY19: 0 | AZ19: 0 | BA19: 0 | BB19: 0 | BC19: 0 | BD19: 0 | BE19: 0 | BF19: 0 | BG19: 0 | BH19: 0 | BI19: 0
L20: PS_OCLine | N20: 0 | O20: 0 | P20: 0 | Q20: 0 | R20: 0 | S20: 0 | T20: 0 | U20: 0 | V20: 0 | W20: 0 | X20: 0 | Y20: 0 | Z20: 0 | AA20: 0 | AB20: 0 | AC20: 0 | AD20: 0 | AE20: 0 | AF20: 0 | AG20: 0 | AH20: 0 | AI20: 0 | AJ20: 0 | AK20: 0 | AL20: 0 | AM20: 0 | AN20: 0 | AO20: 0 | AP20: 0 | AQ20: 0 | AR20: 0 | AS20: 0 | AT20: 0 | AU20: 0 | AV20: 0 | AW20: 0 | AX20: 0 | AY20: 0 | AZ20: 0 | BA20: 0 | BB20: 0 | BC20: 0 | BD20: 0 | BE20: 0 | BF20: 0 | BG20: 0 | BH20: 0 | BI20: 0
L22: Wait_R31 | N22: 0 | O22: 0 | P22: 0 | Q22: 0 | R22: 0 | S22: 0
L23: Wait_R32 | N23: 17 | O23: 41 | P23: 0 | Q23: 41 | R23: 0 | S23: 0
L24: Wait_R33 | N24: 52 | O24: 2 | P24: 0 | Q24: 2 | R24: 0 | S24: 0
L25: CFRF(R31) | N25: 0 | O25: 0 | P25: 0 | Q25: 0 | R25: 0 | S25: 0
L26: CFRS(R32) | N26: 96 | O26: 0 | P26: 96 | Q26: 1 | R26: 0 | S26: 0
L27: CFRF_1(R33) | N27: 506 | O27: 661 | P27: 0 | Q27: 308 | R27: 0 | S27: 0
L28: CFRF_1(R32) | N28: 776 | O28: 852 | P28: 0 | Q28: 309 | R28: 0 | S28: 0
L29: CFRF_2(R32) | N29: 62 | O29: 320 | P29: 136 | Q29: 161 | R29: 0 | S29: 0
L30: CFRF_2(R33) | N30: 216 | O30: 268 | P30: 154 | Q30: 128 | R30: 0 | S30: 0
L31: CFRS(R33) | N31: 906 | O31: 850 | P31: 76 | Q31: 80 | R31: 0 | S31: 0
L32: AOI | N32: 168 | O32: 177 | P32: 281 | Q32: 6 | R32: 0 | S32: 0
L33: CFGB | N33: 1467 | O33: 1406 | P33: 0 | Q33: 848 | R33: 0 | S33: 0
L34: CFDR | N34: 147 | O34: 153 | P34: 136
L35: SORTER_R | N35: 490 | O35: 361 | P35: 156
L36: CFGB2
A101: Cell Bank
A102: Array | B102: Product | C102: 7"D(700Y) | D102: 7"A(700B) | E102: ¡@ | F102: 8D2(800K) | G102: 8+3.5"(800G) | H102: 10.2"(AZBH) | I102: 9.7"H(970Z) | J102: 18.95"(AIZP) | K102: 22"V6(BBZD) | L102: ¡@
B103: TFT(P) | C103: 35 | D103: 0 | E103: ¡@ | F103: 0 | G103: 0 | H103: 581 | I103: 0 | J103: 0 | K103: 0 | L103: ¡@
B104: TFT(E) | C104: 0 | D104: 0 | E104: ¡@ | F104: 0 | G104: 0 | H104: 0 | I104: 0 | J104: 0 | K104: 0 | L104: ¡@
A105: CF | B105: Product | C105: 7"D(700J) | D105: 7"A(700D) | E105: 7"A(700F) | F105: 8D2(800A) | G105: 8+3.5"(800C) | H105: 10.2"(AZBA) | I105: 9.7"H(970B) | J105: 18.95"(AIZL) | K105: 22"V0(BBZA) | L105: 7" TP(700E)
B106: ICF(P) | C106: 26 | D106: 66 | E106: 0 | F106: 32 | G106: 0 | H106: 0 | I106: 0 | J106: 0 | K106: 0 | L106: 0
B107: ICF(E) | C107: 0 | D107: 312 | E107: 93 | F107: 0 | G107: 0 | H107: 164 | I107: 3 | J107: 0 | K107: 0 | L107: 0
A108: ¡@ | B108: Diff(CF-Array) | C108: =C106+C107-C103-C104 -> -9 | D108: =D106+D107-D103-D104 -> 378 | E108: =E106+E107-E103-E104 -> 93 | F108: =F106+F107-F103-F104 -> 32 | G108: =G106+G107-G103-G104 -> 0 | H108: =H106+H107-H103-H104 -> -417 | I108: =I106+I107-I103-I104 -> 3 | J108: =J106+J107-J103-J104 -> 0 | K108: =K106+K107-K103-K104 -> 0 | L108: =L106+L107 -> 0
A109: Array | B109: Product | C109: 17"VC(AGZT) | D109: 17"VC(AGZV) | E109: 23"(BCZC) | F109: 23"(BCZA) | G109: 23.6"(BCFA) | H109: 9"(900B) | I109: 4.3"(430A) | J109: 6.5"(650A) | K109: 5"(500D) | L109: Total WIP(TFT)
B110: TFT(P) | C110: 0 | D110: 0 | E110: 91 | F110: 1125 | G110: 0 | H110: 0 | I110: 0 | J110: 0 | K110: 1631 | L110: =SUM(C103:L104,C110:K111) -> 4600
B111: TFT(E) | C111: 0 | D111: 0 | E111: 18 | F111: 0 | G111: 977 | H111: 0 | I111: 0 | J111: 0 | K111: 142
A112: CF | B112: Product | C112: 17"VC(AGZP) | D112: 17"VC(AGZQ) | E112: 23"(BCZB) | F112: 23"(BCZA) | G112: 23.6"(BCFA) | H112: 9"(900A) | I112: 4.3"(430A) | J112: 6.5"(650A) | K112: 5"(500B) | L112: Total WIP(CF)
B113: ICF(P) | C113: 0 | D113: 0 | E113: 55 | F113: 2067 | G113: 0 | H113: 2514 | I113: 1325 | J113: 0 | K113: 1790 | L113: =SUM(C106:L107,C113:K114) -> 16360
B114: ICF(E) | C114: 0 | D114: 0 | E114: 0 | F114: 543 | G114: 5808 | H114: 402 | I114: 872 | J114: 0 | K114: 288
A115: ¡@ | B115: Diff(CF-Array) | C115: =C113+C114+D113+D114-C110-C111 -> 0 | D115: ¡@ | E115: =E113+E114-E110-E111 -> -54 | F115: =F113+F114-F110-F111 -> 1485 | G115: =G113+G114-G110-G111 -> 4831 | H115: =H113+H114-H110-H111 -> 2916 | I115: =I113+I114-I110-I111 -> 2197 | J115: =J113+J114-J110-J111 -> 0 | K115: =K113+K114-K110-K111 -> 305 | L115: =L113-L110 -> 11760
A137: KPI | B137: Hit Ratio(%) | D137: In-Line Move(sub) | E137: T/R(%) | F137: CST U% | G137: HoldWIP (sub) | H137: Scrap (sub) | I137: Total WIP (sub) | K137: Inventory
B138: Input | C138: Output | I138: In-Line | J138: Rework | K138: Unpack | L138: Rework
A139: Target | B139: =E111 -> 18 | C139: =E133 -> 0 | D139: N/A | E139: 2 | F139: 0.85 | G139: 1000 | H139: 3 | I139: 9500 | J139: 1000 | K139: 3000 | L139: 2000
B140: =I111 -> 0 | C140: =I133 -> 0 | E140: ¡@
A141: Daily | B141: =F111+G111 -> 977 | C141: =F133+G133 -> 0 | D141: 22852 | E141: 1.2943642027754176 | F141: 0.85960000000000003 | G141: 4268 | H141: 1 | I141: 20632 | K141: =IF(K142="","",SUM(K142,L142)) -> ¡@
B142: =IF(B139=0,0,B141/B139) -> 54.277777777777779 | C142: =IF(C139=0,0,C141/C139) -> 0 | D142: ¡@ | E142: ¡@ | F142: ¡@ | G142: ¡@ | H142: ¡@ | I142: 17655 | J142: 2977 | K142: ¡@ | L142: ¡@
A143: MTD | B143: =J111+K111 -> 142 | C143: =J133+K133 -> 0 | D143: 608205 | E143: ¡@ | F143: ¡@ | G143: ¡@ | H143: 108 | I143: ¡@ | J143: ¡@ | K143: ¡@ | L143: ¡@
B144: =IF(B140=0,0,B143/B140) -> 0 | C144: =IF(C140=0,0,C143/C140) -> 0
A145: KPI | B145: Total Line Yield (¦©°£¹êÅç³ø¼o) | C145: Total Line Yield (P + E) | D145: Total Rework Ratio | E145: C/T(day) | G145: Shipping | J145: Empty CST | K145: Cell Bank CST | L145: Error CST
E146: E | F146: P | G146: All Chip Good | H146: Partial Chip Good | I146: Partial Chip Ratio
A147: Target | B147: 0.999 | C147: 0.999 | D147: 4.3299999999999998E-2 | E147: 3.7 | F147: 3.7 | G147: N/A | H147: N/A | I147: N/A | J147: 15 | K147: ¡@ | L147: ¡@
F148: ¡@ | G148: ¡@ | H148: ¡@ | I148: ¡@
A149: Daily | B149: 0 | C149: 0 | D149: 0 | E149: 6.840872019279554 | F149: 3.0417967204317033 | G149: 1767 | H149: 178 | I149: =IF(H149=0,0,H149/(G149+H149)) -> 9.1516709511568123E-2 | J149: 24 | K149: 155 | L149: 4
B150: ¡@ | C150: ¡@ | D150: ¡@ | E150: ¡@ | F150: ¡@ | G150: ¡@ | H150: ¡@ | I150: ¡@
A151: MTD | B151: 0.99917979002624668 | C151: 0.9986337304623456 | D151: 3.7336507415312206E-2 | E151: 11.581694633224894 | F151: 5.0418977244273551 | G151: 59160 | H151: 8248 | I151: =IF(H151=0,0,H151/(G151+H151)) -> 0.12235936387372419 | J151: ¡@ | K151: ¡@ | L151: ¡@
B152: ¡@ | C152: ¡@ | D152: ¡@ | E152: ¡@ | F152: ¡@ | G152: ¡@ | H152: ¡@ | I152: ¡@ | J152: ¡@ | K152: ¡@ | L152: ¡@
A164: Empty CST | B164: 12
A165: Inline WIP CST | B165: 237
A166: Cell Bank CST | B166: 268
A167: Empty CST(N-EQP) | B167: 31
A168: MQC CST | B168: 24
A169: Error CST | B169: 0