A1: T1CF ±á³ø
A2: ¦L»s¤é´Á:2011/6/16 ¤W¤È 07:21:56 | E2: ³øªí´Á¶¡:20110615 07:00~20110616 06:59 | Q2: »s ªí ³¡ ªù : T1/PP-PPC r04
A3: §ë¤J | B3: ¤Ø¤o | C3: ¥»¤ë¥Ø¼Ð | D3: ¤µ¤é­p¹º | E3: ¬Q¤é­p¹º | F3: ¬Q¤é¹êÁZ(E) | G3: ¬Q¤é¹êÁZ(P) | H3: ®t²§ | I3: ²Ö­p­p¹º | J3: ²Ö­p¹êÁZ(E) | K3: ²Ö­p¹êÁZ(P) | L3: ®t²§
A4: ¡@ | B4: ¡@ | C4: ¡@ | D4: ¡@ | E4: ¡@ | F4: ¡@ | G4: ¡@ | H4: =IF(F4="","",G4+F4-E4) -> ¡@ | I4: ¡@ | J4: ¡@ | K4: ¡@ | L4: =IF(J4="","",J4+K4-I4) -> ¡@
A5: ¡@ | B5: ¡@ | C5: ¡@ | D5: ¡@ | E5: ¡@ | F5: ¡@ | G5: ¡@ | H5: =IF(F5="","",G5+F5-E5) -> ¡@ | I5: ¡@ | J5: ¡@ | K5: ¡@ | L5: =IF(J5="","",J5+K5-I5) -> ¡@
A6: OC-BM | B6: ¡@ | C6: ¡@ | D6: ¡@ | E6: ¡@ | F6: ¡@ | G6: ¡@ | H6: =IF(F6="","",G6+F6-E6) -> ¡@ | I6: ¡@ | J6: ¡@ | K6: ¡@ | L6: =IF(J6="","",J6+K6-I6) -> ¡@
A7: ¡@ | B7: SUB | C7: =SUM(C4:C6) -> 0 | D7: =SUM(D4:D6) -> 0 | E7: =SUM(E4:E6) -> 0 | F7: =SUM(F4:F6) -> 0 | G7: =SUM(G4:G6) -> 0 | H7: =SUM(H4:H6) -> 0 | I7: =SUM(I4:I6) -> 0 | J7: =SUM(J4:J6) -> 0 | K7: =SUM(K4:K6) -> 0 | L7: =SUM(L4:L6) -> 0
A8: ¡@ | B8: 430A1F003 | C8: 2592 | D8: 0 | E8: 0 | F8: 0 | G8: 0 | H8: =IF(F8="","",G8+F8-E8) -> 0 | I8: 2592 | J8: 0 | K8: 2592 | L8: =IF(J8="","",J8+K8-I8) -> 0
A9: ¡@ | B9: 500B1F003 | C9: 360 | D9: 0 | E9: 0 | F9: 0 | G9: 0 | H9: =IF(F9="","",G9+F9-E9) -> 0 | I9: 360 | J9: 0 | K9: 360 | L9: =IF(J9="","",J9+K9-I9) -> 0
A10: ¡@ | B10: 500C1F003 | C10: 800 | D10: 0 | E10: 0 | F10: 0 | G10: 0 | H10: =IF(F10="","",G10+F10-E10) -> 0 | I10: 800 | J10: 0 | K10: 800 | L10: =IF(J10="","",J10+K10-I10) -> 0
A11: ¡@ | B11: 700D1F004 | C11: 6600 | D11: 0 | E11: 0 | F11: 0 | G11: 0 | H11: =IF(F11="","",G11+F11-E11) -> 0 | I11: 0 | J11: 0 | K11: 0 | L11: =IF(J11="","",J11+K11-I11) -> 0
A12: ¡@ | B12: 700J1F003 | C12: 2251 | D12: 0 | E12: 0 | F12: 0 | G12: 0 | H12: =IF(F12="","",G12+F12-E12) -> 0 | I12: 2251 | J12: 0 | K12: 2088 | L12: =IF(J12="","",J12+K12-I12) -> -163
A13: ¡@ | B13: 700J1F003-R | C13: 0 | D13: 0 | E13: 0 | F13: 0 | G13: 0 | H13: =IF(F13="","",G13+F13-E13) -> 0 | I13: 0 | J13: 0 | K13: 163 | L13: =IF(J13="","",J13+K13-I13) -> 163
A14: ¡@ | B14: 700K1F003 | C14: 0 | D14: 0 | E14: 0 | F14: 0 | G14: 0 | H14: =IF(F14="","",G14+F14-E14) -> 0 | I14: 0 | J14: 75 | K14: 0 | L14: =IF(J14="","",J14+K14-I14) -> 75
A15: ¡@ | B15: 700L1F004 | C15: 0 | D15: 0 | E15: 0 | F15: 0 | G15: 0 | H15: =IF(F15="","",G15+F15-E15) -> 0 | I15: 0 | J15: 72 | K15: 0 | L15: =IF(J15="","",J15+K15-I15) -> 72
A16: ¡@ | B16: 900A1F003 | C16: 6397 | D16: 0 | E16: 0 | F16: 0 | G16: 0 | H16: =IF(F16="","",G16+F16-E16) -> 0 | I16: 3797 | J16: 0 | K16: 3017 | L16: =IF(J16="","",J16+K16-I16) -> -780
A17: ¡@ | B17: 900A1F003-R | C17: 0 | D17: 0 | E17: 0 | F17: 0 | G17: 0 | H17: =IF(F17="","",G17+F17-E17) -> 0 | I17: 0 | J17: 0 | K17: 780 | L17: =IF(J17="","",J17+K17-I17) -> 780
A18: BM | B18: 970B1F008 | C18: 745 | D18: 0 | E18: 0 | F18: 0 | G18: 0 | H18: =IF(F18="","",G18+F18-E18) -> 0 | I18: 745 | J18: 745 | K18: 0 | L18: =IF(J18="","",J18+K18-I18) -> 0
A19: ¡@ | B19: AZBA1F003 | C19: 2064 | D19: 0 | E19: 0 | F19: 0 | G19: 0 | H19: =IF(F19="","",G19+F19-E19) -> 0 | I19: 2064 | J19: 2064 | K19: 0 | L19: =IF(J19="","",J19+K19-I19) -> 0
A20: ¡@ | B20: AZBB1F003 | C20: 0 | D20: 0 | E20: 0 | F20: 0 | G20: 0 | H20: =IF(F20="","",G20+F20-E20) -> 0 | I20: 0 | J20: 76 | K20: 0 | L20: =IF(J20="","",J20+K20-I20) -> 76
A21: ¡@ | B21: BCFA1F003 | C21: 21346 | D21: 0 | E21: 0 | F21: 0 | G21: 0 | H21: =IF(F21="","",G21+F21-E21) -> 0 | I21: 5946 | J21: 5204 | K21: 0 | L21: =IF(J21="","",J21+K21-I21) -> -742
A22: ¡@ | B22: BCFA1F003-R | C22: 0 | D22: 0 | E22: 0 | F22: 0 | G22: 0 | H22: =IF(F22="","",G22+F22-E22) -> 0 | I22: 0 | J22: 742 | K22: 0 | L22: =IF(J22="","",J22+K22-I22) -> 742
A23: ¡@ | B23: BCZA1F003 | C23: 7522 | D23: 1500 | E23: 1500 | F23: 1152 | G23: 0 | H23: =IF(F23="","",G23+F23-E23) -> -348 | I23: 5222 | J23: 1152 | K23: 3722 | L23: =IF(J23="","",J23+K23-I23) -> -348
A24: ¡@ | B24: BCZA1F003-R | C24: 0 | D24: 0 | E24: 0 | F24: 0 | G24: 17 | H24: =IF(F24="","",G24+F24-E24) -> 17 | I24: 0 | J24: 0 | K24: 17 | L24: =IF(J24="","",J24+K24-I24) -> 17
A25: ¡@ | B25: BCZB1F003 | C25: 6000 | D25: 0 | E25: 0 | F25: 0 | G25: 0 | H25: =IF(F25="","",G25+F25-E25) -> 0 | I25: 0 | J25: 0 | K25: 0 | L25: =IF(J25="","",J25+K25-I25) -> 0
A26: ¡@ | B26: BCZB1F003-R | C26: 0 | D26: 0 | E26: 0 | F26: 0 | G26: 0 | H26: =IF(F26="","",G26+F26-E26) -> 0 | I26: 0 | J26: 0 | K26: 0 | L26: =IF(J26="","",J26+K26-I26) -> 0
A27: ¡@ | B27: BCZC1F003 | C27: 2800 | D27: 0 | E27: 0 | F27: 0 | G27: 0 | H27: =IF(F27="","",G27+F27-E27) -> 0 | I27: 0 | J27: 0 | K27: 0 | L27: =IF(J27="","",J27+K27-I27) -> 0
A28: ¡@ | B28: SUB | C28: =SUM(C8:C27) -> 59477 | D28: =SUM(D8:D27) -> 1500 | E28: =SUM(E8:E27) -> 1500 | F28: =SUM(F8:F27) -> 1152 | G28: =SUM(G8:G27) -> 17 | H28: =SUM(H8:H27) -> -331 | I28: =SUM(I8:I27) -> 23777 | J28: =SUM(J8:J27) -> 10130 | K28: =SUM(K8:K27) -> 13539 | L28: =SUM(L8:L27) -> -108
A29: Á`­p | B29: TOTAL | C29: =C28+C7 -> 59477 | D29: =D28+D7 -> 1500 | E29: =E28+E7 -> 1500 | F29: =F28+F7 -> 1152 | G29: =G28+G7 -> 17 | H29: =H28+H7 -> -331 | I29: =I28+I7 -> 23777 | J29: =J28+J7 -> 10130 | K29: =K28+K7 -> 13539 | L29: =L28+L7 -> -108
A30: ²£¥X | B30: ¤Ø¤o | C30: ¥»¤ë¥Ø¼Ð | D30: ¤µ¤é­p¹º | E30: ¬Q¤é­p¹º | F30: ¬Q¤é¹êÁZ(E) | G30: ¬Q¤é¹êÁZ(P) | H30: ®t²§ | I30: ²Ö­p­p¹º | J30: ²Ö­p¹êÁZ(E) | K30: ²Ö­p¹êÁZ(P) | L30: ®t²§
A31: ¡@ | B31: ¡@ | C31: ¡@ | D31: ¡@ | E31: ¡@ | F31: ¡@ | G31: ¡@ | H31: =IF(F31="","",F31+G31-E31) -> ¡@ | I31: ¡@ | J31: ¡@ | K31: ¡@ | L31: =IF(J31="","",J31+K31-I31) -> ¡@
A32: ¡@ | B32: ¡@ | C32: ¡@ | D32: ¡@ | E32: ¡@ | F32: ¡@ | G32: ¡@ | H32: =IF(F32="","",F32+G32-E32) -> ¡@ | I32: ¡@ | J32: ¡@ | K32: ¡@ | L32: =IF(J32="","",J32+K32-I32) -> ¡@
A33: OC-BM§ë¤J | B33: ¡@ | C33: ¡@ | D33: ¡@ | E33: ¡@ | F33: ¡@ | G33: ¡@ | H33: =IF(F33="","",F33+G33-E33) -> ¡@ | I33: ¡@ | J33: ¡@ | K33: ¡@ | L33: =IF(J33="","",J33+K33-I33) -> ¡@
A34: ¡@ | B34: SUB | C34: =SUM(C31:C33) -> 0 | D34: =SUM(D31:D33) -> 0 | E34: =SUM(E31:E33) -> 0 | F34: =SUM(F31:F33) -> 0 | G34: =SUM(G31:G33) -> 0 | H34: =SUM(H31:H33) -> 0 | I34: =SUM(I31:I33) -> 0 | J34: =SUM(J31:J33) -> 0 | K34: =SUM(K31:K33) -> 0 | L34: =SUM(L31:L33) -> 0
A35: ¡@ | B35: 430A1F003 | C35: 3006 | D35: 0 | E35: 0 | F35: 0 | G35: 0 | H35: =IF(F35="","",F35+G35-E35) -> 0 | I35: 3006 | J35: 725 | K35: 2281 | L35: =IF(J35="","",J35+K35-I35) -> 0
A36: ¡@ | B36: 500B1F003 | C36: 3302 | D36: 0 | E36: 0 | F36: 0 | G36: 0 | H36: =IF(F36="","",F36+G36-E36) -> 0 | I36: 3302 | J36: 288 | K36: 3086 | L36: =IF(J36="","",J36+K36-I36) -> 72
A37: ¡@ | B37: 500C1F003 | C37: 769 | D37: 0 | E37: 0 | F37: 0 | G37: 0 | H37: =IF(F37="","",F37+G37-E37) -> 0 | I37: 769 | J37: 140 | K37: 629 | L37: =IF(J37="","",J37+K37-I37) -> 0
A38: ¡@ | B38: 700D1F004 | C38: 6336 | D38: 0 | E38: 0 | F38: 0 | G38: 0 | H38: =IF(F38="","",F38+G38-E38) -> 0 | I38: 0 | J38: 0 | K38: 52 | L38: =IF(J38="","",J38+K38-I38) -> 52
A39: ¡@ | B39: 700J1F003 | C39: 2199 | D39: 0 | E39: 0 | F39: 0 | G39: 0 | H39: =IF(F39="","",F39+G39-E39) -> 0 | I39: 2199 | J39: 125 | K39: 1920 | L39: =IF(J39="","",J39+K39-I39) -> -154
A40: ¡@ | B40: 700J1F003-R | C40: 0 | D40: 0 | E40: 0 | F40: 0 | G40: 0 | H40: =IF(F40="","",F40+G40-E40) -> 0 | I40: 0 | J40: 18 | K40: 136 | L40: =IF(J40="","",J40+K40-I40) -> 154
A41: ¡@ | B41: 700K1F003 | C41: 0 | D41: 0 | E41: 0 | F41: 0 | G41: 0 | H41: =IF(F41="","",F41+G41-E41) -> 0 | I41: 0 | J41: 0 | K41: 0 | L41: =IF(J41="","",J41+K41-I41) -> 0
A42: ¡@ | B42: 700L1F004 | C42: 0 | D42: 0 | E42: 0 | F42: 58 | G42: 0 | H42: =IF(F42="","",F42+G42-E42) -> 58 | I42: 0 | J42: 58 | K42: 0 | L42: =IF(J42="","",J42+K42-I42) -> 58
A43: ¡@ | B43: 900A1F003 | C43: 6141 | D43: 997 | E43: 173 | F43: 139 | G43: 1575 | H43: =IF(F43="","",F43+G43-E43) -> 1541 | I43: 1687 | J43: 139 | K43: 2511 | L43: =IF(J43="","",J43+K43-I43) -> 963
A44: ¡@ | B44: 900A1F003-R | C44: 0 | D44: 0 | E44: 0 | F44: 69 | G44: 0 | H44: =IF(F44="","",F44+G44-E44) -> 69 | I44: 0 | J44: 74 | K44: 573 | L44: =IF(J44="","",J44+K44-I44) -> 647
A45: BM§ë¤J | B45: 970B1F008 | C45: 676 | D45: 0 | E45: 0 | F45: 0 | G45: 0 | H45: =IF(F45="","",F45+G45-E45) -> 0 | I45: 296 | J45: 296 | K45: 0 | L45: =IF(J45="","",J45+K45-I45) -> 0
A46: ¤§²£¥X | B46: AZBA1F003 | C46: 1981 | D46: 0 | E46: 0 | F46: 0 | G46: 0 | H46: =IF(F46="","",F46+G46-E46) -> 0 | I46: 0 | J46: 0 | K46: 0 | L46: =IF(J46="","",J46+K46-I46) -> 0
A47: ¡@ | B47: AZBB1F003 | C47: 0 | D47: 0 | E47: 0 | F47: 0 | G47: 0 | H47: =IF(F47="","",F47+G47-E47) -> 0 | I47: 0 | J47: 0 | K47: 0 | L47: =IF(J47="","",J47+K47-I47) -> 0
A48: ¡@ | B48: BCFA1F003 | C48: 11852 | D48: 1188 | E48: 2000 | F48: 2160 | G48: 0 | H48: =IF(F48="","",F48+G48-E48) -> 160 | I48: 4520 | J48: 4725 | K48: 0 | L48: =IF(J48="","",J48+K48-I48) -> 205
A49: ¡@ | B49: BCFA1F003-R | C49: 0 | D49: 0 | E49: 0 | F49: 504 | G49: 0 | H49: =IF(F49="","",F49+G49-E49) -> 504 | I49: 0 | J49: 504 | K49: 0 | L49: =IF(J49="","",J49+K49-I49) -> 504
A50: ¡@ | B50: BCZA1F003 | C50: 11422 | D50: 0 | E50: 0 | F50: 0 | G50: 0 | H50: =IF(F50="","",F50+G50-E50) -> 0 | I50: 7774 | J50: 144 | K50: 7630 | L50: =IF(J50="","",J50+K50-I50) -> 0
A51: ¡@ | B51: BCZA1F003-R | C51: 0 | D51: 0 | E51: 0 | F51: 0 | G51: 0 | H51: =IF(F51="","",F51+G51-E51) -> 0 | I51: 0 | J51: 0 | K51: 0 | L51: =IF(J51="","",J51+K51-I51) -> 0
A52: ¡@ | B52: BCZB1F003 | C52: 5760 | D52: 0 | E52: 0 | F52: 0 | G52: 0 | H52: =IF(F52="","",F52+G52-E52) -> 0 | I52: 0 | J52: 0 | K52: 0 | L52: =IF(J52="","",J52+K52-I52) -> 0
A53: ¡@ | B53: BCZB1F003-R | C53: 0 | D53: 0 | E53: 0 | F53: 0 | G53: 0 | H53: =IF(F53="","",F53+G53-E53) -> 0 | I53: 0 | J53: 0 | K53: 0 | L53: =IF(J53="","",J53+K53-I53) -> 0
A54: ¡@ | B54: BCZC1F003 | C54: 432 | D54: 0 | E54: 0 | F54: 0 | G54: 0 | H54: =IF(F54="","",F54+G54-E54) -> 0 | I54: 432 | J54: 432 | K54: 0 | L54: =IF(J54="","",J54+K54-I54) -> 0
A55: ¡@ | B55: SUB | C55: =SUM(C35:C54) -> 53876 | D55: =SUM(D35:D54) -> 2185 | E55: =SUM(E35:E54) -> 2173 | F55: =SUM(F35:F54) -> 2930 | G55: =SUM(G35:G54) -> 1575 | H55: =SUM(H35:H54) -> 2332 | I55: =SUM(I35:I54) -> 23985 | J55: =SUM(J35:J54) -> 7668 | K55: =SUM(K35:K54) -> 18818 | L55: =SUM(L35:L54) -> 2501
A56: Yield | B56: Rework Line | C56: Unpack | D56: ¡@ | E56: ¡@ | F56: ¡@ | G56: ¡@ | H56: ¡@ | I56: ¡@ | J56: ¡@ | K56: ¡@ | L56: ¡@
A57: Line YD | B57: =IF(SUM(Sheet2!Q19:Q27,Sheet2!O23:O25)=0,0,SUM(Sheet2!O23:O25)/SUM(Sheet2!Q19:Q27,Sheet2!O23:O25)) -> 0.10886075949367088 | C57: =IF(SUM(Sheet2!O2,Sheet2!Q2)=0,0,Sheet2!O2/SUM(Sheet2!O2,Sheet2!Q2)) -> 0.92487046632124348 | D57: ¡@ | E57: ¡@ | F57: ¡@ | G57: ¡@ | H57: ¡@ | I57: ¡@ | J57: ¡@ | K57: ¡@ | L57: ¡@
A58: Rework Rate | B58: ¡@ | C58: ¡@ | D58: ¡@ | E58: ¡@ | F58: ¡@ | G58: ¡@ | H58: ¡@ | I58: ¡@ | J58: ¡@ | K58: ¡@ | L58: ¡@
A59: Á`­p | B59: TOTAL | C59: =C55+C34 -> 53876 | D59: =D55+D34 -> 2185 | E59: =E55+E34 -> 2173 | F59: =F55+F34 -> 2930 | G59: =G55+G34 -> 1575 | H59: =H55+H34 -> 2332 | I59: =I55+I34 -> 23985 | J59: =J55+J34 -> 7668 | K59: =K55+K34 -> 18818 | L59: =L55+L34 -> 2501
A60: KPI | B60: Hit Ratio(%) | D60: In-Line Move(sub) | E60: T/R(%) | F60: CST U% | G60: HoldWIP (sub) | H60: Scrap (sub) | I60: Total WIP (sub) | K60: Inventory
B61: Input | C61: Output | I61: In-Line | J61: Rework | K61: Unpack | L61: Rework
A62: Target | B62: =E29 -> 1500 | C62: =E59 -> 2173 | D62: N/A | E62: 2 | F62: 0.8 | G62: 1000 | H62: 3 | I62: 10000 | J62: 3000 | K62: 2000 | L62: 1000
B63: =I29 -> 23777 | C63: =I59 -> 23985 | E63: ¡@
A64: Daily | B64: =F29+G29 -> 1169 | C64: =F59+G59 -> 4505 | D64: 15633 | E64: 3.148006443817962 | F64: 0.54369999999999996 | G64: 1285 | H64: 4 | I64: 5009 | K64: =IF(K65="","",SUM(K65,L65)) -> 2477
B65: =IF(B62=0,0,B64/B62) -> 0.77933333333333332 | C65: =IF(C62=0,0,C64/C62) -> 2.0731707317073171 | D65: ¡@ | E65: ¡@ | F65: ¡@ | G65: ¡@ | H65: ¡@ | I65: 4966 | J65: =C93+D93+E93+F93+G93+H93+I93+J93+K93 -> 4187 | K65: =IF(Sheet2!O2="","",Sheet2!O2) -> 1071 | L65: =L93 -> 1406
A66: MTD | B66: =J29+K29 -> 23669 | C66: =J59+K59 -> 26486 | D66: 227366 | E66: ¡@ | F66: ¡@ | G66: ¡@ | H66: 41 | I66: ¡@ | J66: ¡@ | K66: ¡@ | L66: ¡@
B67: =IF(B63=0,0,B66/B63) -> 0.99545779534844603 | C67: =IF(C63=0,0,C66/C63) -> 1.1042735042735043
A68: KPI | B68: Total Line Yield (¦©°£¹êÅç³ø¼o) | C68: Total Line Yield (P + E) | D68: Total Rework Ratio | E68: Shipping | H68: CST Status | I68: Daily | J68: KPI | K68: C/T | Q68: ¡@
E69: All Chip Good | F69: Partial Chip Good | G69: Partial Chip Ratio | K69: E | L69: P | Q69: ¡@
A70: Target | B70: 0.998 | C70: 0.998 | D70: 4.3499999999999997E-2 | E70: N/A | F70: N/A | G70: N/A | H70: Empty CST | I70: =Sheet2!B164 -> 12 | J70: Target(BM) | K70: 10 | L70: 4.2 | M70: ¡@ | Q70: ¡@
E71: ¡@ | F71: ¡@ | G71: ¡@ | H71: Inline WIP CST | I71: =Sheet2!B165 -> 237 | J71: Daily(BM) | K71: 4.989971282075591 | L71: 2.7072946696281552 | M71: ¡@ | Q71: ¡@
A72: Daily | B72: =IF((SUM(Sheet7!P13,Sheet7!P14,Sheet7!S2:S33,Sheet7!J2)-Sheet7!S13-Sheet7!S14-Sheet7!I2)=0,0,(SUM(Sheet7!P13,Sheet7!P14,Sheet7!S2:S33)-Sheet7!S13-Sheet7!S14)/(SUM(Sheet7!P13,Sheet7!P14,Sheet7!S2:S33,Sheet7!J2)-Sheet7!S13-Sheet7!S14-Sheet7!I2)) -> 1 | C72: =IF((SUM(Sheet7!P13,Sheet7!P14,Sheet7!S2:S33,Sheet7!J2)-Sheet7!S13-Sheet7!S14)=0,0,(SUM(Sheet7!P13,Sheet7!P14,Sheet7!S2:S33)-Sheet7!S13-Sheet7!S14)/(SUM(Sheet7!P13,Sheet7!P14,Sheet7!S2:S33,Sheet7!J2)-Sheet7!S13-Sheet7!S14)) -> 0.99832214765100669 | D72: =IF((SUM(Sheet2!P13,Sheet2!S2:S33,H64)-Sheet2!S13)=0,0,SUM(Sheet2!S2:S33)/(SUM(Sheet2!P13,Sheet2!P14,Sheet2!S2:S33)-Sheet2!S13-Sheet2!S14)) -> 7.2494669509594878E-2 | E72: 4506 | F72: 215 | G72: =IF(F72=0,0,F72/(E72+F72)) -> 4.5541198898538443E-2 | H72: Cell Bank CST | I72: =Sheet2!B166 -> 268 | J72: MTD(BM) | K72: 5.5426854942508017 | L72: 3.772124688618161 | M72: ¡@ | Q72: ¡@
B73: ¡@ | C73: ¡@ | D73: ¡@ | E73: ¡@ | F73: ¡@ | G73: ¡@ | H73: Empty CST(IN-EQP) | I73: =Sheet2!B167 -> 31 | J73: Target(OC-BM) | K73: 10 | L73: 10 | M73: ¡@ | Q73: ¡@
A74: MTD | B74: 0.99889163926552627 | C74: 0.99848585567619474 | D74: 5.093020675370788E-2 | E74: 26252 | F74: 1714 | G74: =IF(F74=0,0,F74/(E74+F74)) -> 6.1288707716512909E-2 | H74: MQC CST | I74: =Sheet2!B168 -> 24 | J74: Daily(OC-BM) | K74: 0 | L74: 0 | M74: ¡@ | N74: ¡@ | Q74: ¡@ | Z74: ¡@
B75: ¡@ | C75: ¡@ | D75: ¡@ | E75: ¡@ | F75: ¡@ | G75: ¡@ | H75: Error CST | I75: =Sheet2!B169 -> 0 | J75: MTD(OC-BM) | K75: 0 | L75: 0 | M75: ¡@ | N75: ¡@ | Q75: ¡@ | Z75: ¡@
A76: Cell Bank | M76: ¡@ | Q76: ¡@ | Z76: ¡@
A77: Array | B77: Product | C77: =Sheet2!C102 -> 7"D(700Y) | D77: =Sheet2!D102 -> 7"A(700B) | E77: ¡@ | F77: =Sheet2!F102 -> 8D2(800K) | G77: ¡@ | H77: =Sheet2!H102 -> 10.2"(AZBH) | I77: =Sheet2!I102 -> 9.7"H(970Z) | J77: =Sheet2!J102 -> 18.95"(AIZP) | K77: =Sheet2!K102 -> 22"V6(BBZD) | L77: ¡@ | M77: ¡@ | O77: ¡@ | Q77: ¡@ | Z77: ¡@
B78: TFT(P) | C78: =Sheet2!C103 -> 35[1] | D78: =Sheet2!D103 -> 0[2] | E78: ¡@ | F78: =Sheet2!F103 -> 0[3] | G78: ¡@ | H78: =Sheet2!H103 -> 581[4] | I78: =Sheet2!I103 -> 0[5] | J78: =Sheet2!J103 -> 0[6] | K78: =Sheet2!K103 -> 0[7] | L78: ¡@ | M78: ¡@ | N78: ¡@ | O78: ¡@ | P78: ¡@ | Q78: ¡@ | Z78: ¡@
B79: TFT(E) | C79: =Sheet2!C104 -> 0[8] | D79: =Sheet2!D104 -> 0[9] | E79: ¡@ | F79: =Sheet2!F104 -> 0[10] | G79: ¡@ | H79: =Sheet2!H104 -> 0[11] | I79: =Sheet2!I104 -> 0[12] | J79: =Sheet2!J104 -> 0[13] | K79: =Sheet2!K104 -> 0[14] | L79: ¡@ | M79: ¡@ | N79: ¡@ | O79: ¡@ | P79: ¡@ | Q79: ¡@ | Z79: ¡@
A80: CF | B80: Product | C80: =Sheet2!C105 -> 7"D(700J) | D80: =Sheet2!D105 -> 7"A(700D) | E80: =Sheet2!E105 -> 7"A(700F) | F80: =Sheet2!F105 -> 8D2(800A) | G80: ¡@ | H80: =Sheet2!H105 -> 10.2"(AZBA) | I80: =Sheet2!I105 -> 9.7"H(970B) | J80: =Sheet2!J105 -> 18.95"(AIZL) | K80: =Sheet2!K105 -> 22"V0(BBZA) | L80: =Sheet2!L105 -> 7" TP(700E) | M80: ¡@ | N80: ¡@ | O80: ¡@ | P80: ¡@ | Q80: ¡@ | Z80: ¡@
B81: ICF(P) | C81: =Sheet2!C106 -> 26[15] | D81: =Sheet2!D106 -> 66[16] | E81: =Sheet2!E106 -> 0[17] | F81: =Sheet2!F106 -> 32[18] | G81: ¡@ | H81: =Sheet2!H106 -> 0[19] | I81: =Sheet2!I106 -> 0[20] | J81: =Sheet2!J106 -> 0[21] | K81: =Sheet2!K106 -> 0[22] | L81: =Sheet2!L106 -> 0[23] | M81: ¡@ | N81: ¡@ | O81: ¡@ | P81: ¡@ | Q81: ¡@ | Z81: ¡@
B82: ICF(E) | C82: =Sheet2!C107 -> 0[24] | D82: =Sheet2!D107 -> 312[25] | E82: =Sheet2!E107 -> 93[26] | F82: =Sheet2!F107 -> 0[27] | G82: ¡@ | H82: =Sheet2!H107 -> 164[28] | I82: =Sheet2!I107 -> 3[29] | J82: =Sheet2!J107 -> 0[30] | K82: =Sheet2!K107 -> 0[31] | L82: =Sheet2!L107 -> 0[32] | M82: ¡@ | N82: ¡@ | Q82: ¡@ | Z82: ¡@
A83: ¡@ | B83: Diff(CF-Array) | C83: =Sheet2!C108 -> -9 | D83: =Sheet2!D108 -> 378 | E83: =Sheet2!E108 -> 93 | F83: =Sheet2!F108 -> 32 | G83: ¡@ | H83: =Sheet2!H108 -> -417 | I83: =Sheet2!I108 -> 3 | J83: =Sheet2!J108 -> 0 | K83: =Sheet2!K108 -> 0 | L83: =Sheet2!L108 -> 0 | M83: ¡@ | Z83: ¡@
A84: Array | B84: Product | C84: =Sheet2!C109 -> 17"VC(AGZT) | D84: =Sheet2!D109 -> 17"VC(AGZV) | E84: =Sheet2!E109 -> 23"(BCZC) | F84: =Sheet2!F109 -> 23"(BCZA) | G84: =Sheet2!G109 -> 23.6"(BCFA) | H84: =Sheet2!H109 -> 9"(900B) | I84: =Sheet2!I109 -> 4.3"(430A) | J84: =Sheet2!J109 -> 6.5"(650A) | K84: =Sheet2!K109 -> 5"(500D) | L84: =Sheet2!L109 -> Total WIP(TFT) | M84: ¡@ | O84: ¡@ | Q84: ¡@ | Z84: ¡@
B85: TFT(P) | C85: =Sheet2!C110 -> 0[33] | D85: =Sheet2!D110 -> 0[34] | E85: =Sheet2!E110 -> 91[35] | F85: =Sheet2!F110 -> 1125[36] | G85: =Sheet2!G110 -> 0[37] | H85: =Sheet2!H110 -> 0[38] | I85: =Sheet2!I110 -> 0[39] | J85: =Sheet2!J110 -> 0[40] | K85: =Sheet2!K110 -> 1631 | L85: =Sheet2!L110 -> 4600 | M85: ¡@ | N85: ¡@ | O85: ¡@ | P85: ¡@ | Q85: ¡@ | Z85: ¡@
B86: TFT(E) | C86: =Sheet2!C111 -> 0[41] | D86: =Sheet2!D111 -> 0[42] | E86: =Sheet2!E111 -> 18[43] | F86: =Sheet2!F111 -> 0[44] | G86: =Sheet2!G111 -> 977[45] | H86: =Sheet2!H111 -> 0[46] | I86: =Sheet2!I111 -> 0[47] | J86: =Sheet2!J111 -> 0[48] | K86: =Sheet2!K111 -> 142 | M86: ¡@ | N86: ¡@ | O86: ¡@ | P86: ¡@ | Q86: ¡@ | Z86: ¡@
A87: CF | B87: Product | C87: =Sheet2!C112 -> 17"VC(AGZP) | D87: =Sheet2!D112 -> 17"VC(AGZQ) | E87: =Sheet2!E112 -> 23"(BCZB) | F87: =Sheet2!F112 -> 23"(BCZA) | G87: =Sheet2!G112 -> 23.6"(BCFA) | H87: =Sheet2!H112 -> 9"(900A) | I87: =Sheet2!I112 -> 4.3"(430A) | J87: =Sheet2!J112 -> 6.5"(650A) | K87: =Sheet2!K112 -> 5"(500B) | L87: =Sheet2!L112 -> Total WIP(CF) | M87: ¡@ | N87: ¡@ | O87: ¡@ | P87: ¡@ | Q87: ¡@ | Z87: ¡@
B88: ICF(P) | C88: =Sheet2!C113 -> 0[49] | D88: =Sheet2!D113 -> 0[50] | E88: =Sheet2!E113 -> 55[51] | F88: =Sheet2!F113 -> 2067[52] | G88: =Sheet2!G113 -> 0[53] | H88: =Sheet2!H113 -> 2514[54] | I88: =Sheet2!I113 -> 1325[55] | J88: =Sheet2!J113 -> 0[56] | K88: =Sheet2!K113 -> 1790 | L88: =Sheet2!L113 -> 16360 | M88: ¡@ | N88: ¡@ | O88: ¡@ | P88: ¡@ | Q88: ¡@ | Z88: ¡@
B89: ICF(E) | C89: =Sheet2!C114 -> 0[57] | D89: =Sheet2!D114 -> 0[58] | E89: =Sheet2!E114 -> 0[59] | F89: =Sheet2!F114 -> 543[60] | G89: =Sheet2!G114 -> 5808[61] | H89: =Sheet2!H114 -> 402[62] | I89: =Sheet2!I114 -> 872[63] | J89: =Sheet2!J114 -> 0[64] | K89: =Sheet2!K114 -> 288 | M89: ¡@ | N89: ¡@ | Q89: ¡@ | Z89: ¡@
A90: ¡@ | B90: Diff(CF-Array) | C90: =Sheet2!C115 -> 0 | D90: ¡@ | E90: =Sheet2!E115 -> -54 | F90: =Sheet2!F115 -> 1485 | G90: =Sheet2!G115 -> 4831 | H90: =Sheet2!H115 -> 2916 | I90: =Sheet2!I115 -> 2197 | J90: =Sheet2!J115 -> 0 | K90: =Sheet2!K115 -> 305 | L90: =Sheet2!L115 -> 11760 | M90: ¡@ | Z90: ¡@
A91: Rework WIP ¤À§G | B91: Product | C91: Wait_R32 | D91: Wait_R33 | E91: R32_910_1 | F91: R32_910_3/ R33_910_3[65] | G91: R33_810_1[66] | H91: R32_ITO_2/ R33_ITO_2[67] | I91: AOI | J91: SORTER_R | K91: 1586 | L91: 0
B92: ¬Q¤éWIP | C92: =Sheet2!N23 -> 17 | D92: =Sheet2!N24 -> 52 | E92: =Sheet2!N28 -> 776 | F92: =Sheet2!N29+Sheet2!N30 -> 278 | G92: =Sheet2!N27 -> 506 | H92: =Sheet2!N26+Sheet2!N31 -> 1002 | I92: =Sheet2!N32 -> 168 | J92: =Sheet2!N35 -> 490 | K92: 887 | L92: =Sheet2!N33+Sheet2!N36 -> 1467
B93: ¤µ¤éWIP | C93: =Sheet2!O23 -> 41 | D93: =Sheet2!O24 -> 2 | E93: =Sheet2!O28 -> 852 | F93: =Sheet2!O29+Sheet2!O30 -> 588 | G93: =Sheet2!O27 -> 661 | H93: =Sheet2!O26+Sheet2!O31 -> 850 | I93: =Sheet2!O32 -> 177 | J93: =Sheet2!O35 -> 361 | K93: 655 | L93: =Sheet2!O33+Sheet2!O36 -> 1406
B94: Total MVMT | C94: =Sheet2!P23 -> 0 | D94: =Sheet2!P24 -> 0 | E94: =Sheet2!P28 -> 0 | F94: =Sheet2!P29+Sheet2!P30 -> 290 | G94: =Sheet2!P27 -> 0 | H94: =Sheet2!P26+Sheet2!P31 -> 172 | I94: =Sheet2!P32 -> 281 | J94: =Sheet2!P35 -> 156 | K94: =Sheet2!P34 -> 136 | L94: =Sheet2!P33+Sheet2!P36 -> 0
A95: Inventory | E95: Rework Out | I95: Rework WIP
A96: Unpack | C96: Rework | E96: PS_Rework_Out[68] | F96: PS_Rework_L3[69] | G96: PS_Rework_Pack_Cst[70] | H96: PS_Rework_Pack_PPBOX[71] | I96: Product | J96: Waiting | K96: Processing | L96: CFGB2
A97: EXG.5µL½¤ | B97: =Sheet2!B3 -> 106 | C97: EXG.5 | D97: =Sheet2!D3 -> 559 | E97: N/A | F97: N/A | G97: N/A | H97: N/A | I97: EXG.5[74] | J97: 0[75] | K97: 323[76] | L97: 370
A98: EXG.63µL½¤ | B98: =Sheet2!B4 -> 0 | C98: EXG.63 | D98: =Sheet2!D4 -> 247 | I98: EXG.63[79] | J98: 39[80] | K98: 350[81] | L98: 0
A99: EXG.7µL½¤ | B99: =Sheet2!B5 -> 965 | C99: EXG.7 | D99: =Sheet2!D5 -> 600 | E99: =Sheet2!A15 -> 0 | F99: =Sheet2!B15 -> 2 | G99: =Sheet2!C15 -> 3622 | H99: =Sheet2!D15 -> 0 | I99: EXG.7[84] | J99: 2[85] | K99: 346[86] | L99: 1251
A100: EXG.63¦³½¤ | B100: =Sheet2!B6 -> 0[87] | C100: ¡@ | D100: ¡@ | E100: ¡@ | F100: ¡@ | I100: ¡@ | L100: ¡@
A101: EXG.7¦³½¤ | B101: =Sheet2!B7 -> 0[88] | C101: ¡@ | D101: ¡@ | E101: ¡@ | F101: ¡@ | G101: ¡@ | H101: ¡@ | I101: ¡@ | J101: ¡@ | K101: ¡@ | L101: ¡@