C1: Move_Hour | D1: 7 | E1: 8 | F1: 9 | G1: 10 | H1: 11 | I1: 12 | J1: 13 | K1: 14 | L1: 15 | M1: 16 | N1: 17 | O1: 18 | P1: 19 | Q1: 20 | R1: 21 | S1: 22 | T1: 23 | U1: 0 | V1: 1 | W1: 2 | X1: 3 | Y1: 4 | Z1: 5 | AA1: 6 | AC1: 7 | AD1: 8 | AE1: 9 | AF1: 10 | AG1: 11 | AH1: 12 | AI1: 13 | AJ1: 14 | AK1: 15 | AL1: 16 | AM1: 17 | AN1: 18 | AO1: 19 | AP1: 20 | AQ1: 21 | AR1: 22 | AS1: 23 | AT1: 0 | AU1: 1 | AV1: 2 | AW1: 3 | AX1: 4 | AY1: 5 | AZ1: 6 | BA1: MAX_Hour
A2: Unpack | B2: T1CF | C2: 40710 | D2: =AC2 -> 0 | E2: =AD2+D2 -> 0 | F2: =AE2+E2 -> 92 | G2: =F2+AF2 -> 212 | H2: =AG2+G2 -> 212 | I2: =AH2+H2 -> 212 | J2: =I2+AI2 -> 284 | K2: =AJ2+J2 -> 428 | L2: =AK2+K2 -> 428 | M2: =L2+AL2 -> 428 | N2: =AM2+M2 -> 428 | O2: =AN2+N2 -> 428 | P2: =O2+AO2 -> 428 | Q2: =AP2+P2 -> 500 | R2: =AQ2+Q2 -> 500 | S2: =R2+AR2 -> 500 | T2: =AS2+S2 -> 500 | U2: =AT2+T2 -> 500 | V2: =U2+AU2 -> 500 | W2: =AV2+V2 -> 500 | X2: =AW2+W2 -> 500 | Y2: =X2+AX2 -> 500 | Z2: =AY2+Y2 -> 644 | AA2: =AZ2+Z2 -> 644 | AB2: ****** | AC2: 0 | AD2: 0 | AE2: 92 | AF2: 120 | AG2: 0 | AH2: 0 | AI2: 72 | AJ2: 144 | AK2: 0 | AL2: 0 | AM2: 0 | AN2: 0 | AO2: 0 | AP2: 72 | AQ2: 0 | AR2: 0 | AS2: 0 | AT2: 0 | AU2: 0 | AV2: 0 | AW2: 0 | AX2: 0 | AY2: 144 | AZ2: 0 | BA2: =MAX(AC2:AZ2) -> 144
A3: BM_Line | B3: T1CF | C3: 40710 | D3: =AC3 -> 65 | E3: =AD3+D3 -> 125 | F3: =AE3+E3 -> 183 | G3: =F3+AF3 -> 270 | H3: =AG3+G3 -> 270 | I3: =AH3+H3 -> 344 | J3: =AI3+I3 -> 448 | K3: =J3+AJ3 -> 520 | L3: =AK3+K3 -> 520 | M3: =AL3+L3 -> 526 | N3: =AM3+M3 -> 531 | O3: =N3+AN3 -> 534 | P3: =AO3+O3 -> 539 | Q3: =AP3+P3 -> 576 | R3: =AQ3+Q3 -> 648 | S3: =R3+AR3 -> 721 | T3: =AS3+S3 -> 795 | U3: =AT3+T3 -> 869 | V3: =AU3+U3 -> 943 | W3: =V3+AV3 -> 1020 | X3: =AW3+W3 -> 1099 | Y3: =AX3+X3 -> 1172 | Z3: =AY3+Y3 -> 1244 | AA3: =Z3+AZ3 -> 1244 | AB3: ****** | AC3: 65 | AD3: 60 | AE3: 58 | AF3: 87 | AG3: 0 | AH3: 74 | AI3: 104 | AJ3: 72 | AK3: 0 | AL3: 6 | AM3: 5 | AN3: 3 | AO3: 5 | AP3: 37 | AQ3: 72 | AR3: 73 | AS3: 74 | AT3: 74 | AU3: 74 | AV3: 77 | AW3: 79 | AX3: 73 | AY3: 72 | AZ3: 0 | BA3: =MAX(AC3:AZ3) -> 104
A4: R_Line | B4: T1CF | C4: 40710 | D4: =AC4 -> 11 | E4: =AD4+D4 -> 51 | F4: =AE4+E4 -> 80 | G4: =F4+AF4 -> 140 | H4: =AG4+G4 -> 156 | I4: =AH4+H4 -> 222 | J4: =I4+AI4 -> 294 | K4: =AJ4+J4 -> 440 | L4: =AK4+K4 -> 464 | M4: =L4+AL4 -> 464 | N4: =AM4+M4 -> 464 | O4: =AN4+N4 -> 464 | P4: =O4+AO4 -> 464 | Q4: =AP4+P4 -> 464 | R4: =AQ4+Q4 -> 472 | S4: =R4+AR4 -> 521 | T4: =AS4+S4 -> 614 | U4: =AT4+T4 -> 687 | V4: =U4+AU4 -> 758 | W4: =AV4+V4 -> 831 | X4: =AW4+W4 -> 882 | Y4: =X4+AX4 -> 939 | Z4: =AY4+Y4 -> 1004 | AA4: =AZ4+Z4 -> 1004 | AB4: ****** | AC4: 11 | AD4: 40 | AE4: 29 | AF4: 60 | AG4: 16 | AH4: 66 | AI4: 72 | AJ4: 146 | AK4: 24 | AL4: 0 | AM4: 0 | AN4: 0 | AO4: 0 | AP4: 0 | AQ4: 8 | AR4: 49 | AS4: 93 | AT4: 73 | AU4: 71 | AV4: 73 | AW4: 51 | AX4: 57 | AY4: 65 | AZ4: 0 | BA4: =MAX(AC4:AZ4) -> 146
A5: B_Line | B5: T1CF | C5: 40710 | D5: =AC5 -> 0 | E5: =AD5+D5 -> 0 | F5: =AE5+E5 -> 0 | G5: =F5+AF5 -> 78 | H5: =AG5+G5 -> 78 | I5: =AH5+H5 -> 150 | J5: =AI5+I5 -> 222 | K5: =J5+AJ5 -> 294 | L5: =AK5+K5 -> 366 | M5: =AL5+L5 -> 438 | N5: =AM5+M5 -> 464 | O5: =N5+AN5 -> 464 | P5: =AO5+O5 -> 464 | Q5: =AP5+P5 -> 464 | R5: =AQ5+Q5 -> 464 | S5: =R5+AR5 -> 464 | T5: =AS5+S5 -> 466 | U5: =AT5+T5 -> 610 | V5: =AU5+U5 -> 682 | W5: =V5+AV5 -> 754 | X5: =AW5+W5 -> 803 | Y5: =AX5+X5 -> 844 | Z5: =AY5+Y5 -> 946 | AA5: =Z5+AZ5 -> 946 | AB5: ****** | AC5: 0 | AD5: 0 | AE5: 0 | AF5: 78 | AG5: 0 | AH5: 72 | AI5: 72 | AJ5: 72 | AK5: 72 | AL5: 72 | AM5: 26 | AN5: 0 | AO5: 0 | AP5: 0 | AQ5: 0 | AR5: 0 | AS5: 2 | AT5: 144 | AU5: 72 | AV5: 72 | AW5: 49 | AX5: 41 | AY5: 102 | AZ5: 0 | BA5: =MAX(AC5:AZ5) -> 144
A6: G_Line | B6: T1CF | C6: 40710 | D6: =AC6 -> 0 | E6: =AD6+D6 -> 8 | F6: =AE6+E6 -> 8 | G6: =F6+AF6 -> 36 | H6: =AG6+G6 -> 36 | I6: =AH6+H6 -> 36 | J6: =I6+AI6 -> 36 | K6: =AJ6+J6 -> 36 | L6: =AK6+K6 -> 36 | M6: =L6+AL6 -> 36 | N6: =AM6+M6 -> 36 | O6: =AN6+N6 -> 36 | P6: =O6+AO6 -> 36 | Q6: =AP6+P6 -> 36 | R6: =AQ6+Q6 -> 36 | S6: =R6+AR6 -> 38 | T6: =AS6+S6 -> 110 | U6: =AT6+T6 -> 182 | V6: =U6+AU6 -> 398 | W6: =AV6+V6 -> 478 | X6: =AW6+W6 -> 480 | Y6: =X6+AX6 -> 624 | Z6: =AY6+Y6 -> 768 | AA6: =AZ6+Z6 -> 768 | AB6: ****** | AC6: 0 | AD6: 8 | AE6: 0 | AF6: 28 | AG6: 0 | AH6: 0 | AI6: 0 | AJ6: 0 | AK6: 0 | AL6: 0 | AM6: 0 | AN6: 0 | AO6: 0 | AP6: 0 | AQ6: 0 | AR6: 2 | AS6: 72 | AT6: 72 | AU6: 216 | AV6: 80 | AW6: 2 | AX6: 144 | AY6: 144 | AZ6: 0 | BA6: =MAX(AC6:AZ6) -> 216
A7: IF_Line | B7: T1CF | C7: 40710 | D7: =AC7 -> 72 | E7: =AD7+D7 -> 144 | F7: =AE7+E7 -> 216 | G7: =F7+AF7 -> 360 | H7: =AG7+G7 -> 432 | I7: =AH7+H7 -> 576 | J7: =AI7+I7 -> 576 | K7: =J7+AJ7 -> 576 | L7: =AK7+K7 -> 576 | M7: =AL7+L7 -> 576 | N7: =AM7+M7 -> 576 | O7: =N7+AN7 -> 576 | P7: =AO7+O7 -> 576 | Q7: =AP7+P7 -> 576 | R7: =AQ7+Q7 -> 576 | S7: =R7+AR7 -> 576 | T7: =AS7+S7 -> 576 | U7: =AT7+T7 -> 648 | V7: =AU7+U7 -> 720 | W7: =V7+AV7 -> 792 | X7: =AW7+W7 -> 864 | Y7: =AX7+X7 -> 936 | Z7: =AY7+Y7 -> 1008 | AA7: =Z7+AZ7 -> 1008 | AB7: ****** | AC7: 72 | AD7: 72 | AE7: 72 | AF7: 144 | AG7: 72 | AH7: 144 | AI7: 0 | AJ7: 0 | AK7: 0 | AL7: 0 | AM7: 0 | AN7: 0 | AO7: 0 | AP7: 0 | AQ7: 0 | AR7: 0 | AS7: 0 | AT7: 72 | AU7: 72 | AV7: 72 | AW7: 72 | AX7: 72 | AY7: 72 | AZ7: 0 | BA7: =MAX(AC7:AZ7) -> 144
A8: ITO_Line | B8: T1CF | C8: 40710 | D8: =AC8 -> 0 | E8: =AD8+D8 -> 144 | F8: =AE8+E8 -> 288 | G8: =F8+AF8 -> 432 | H8: =AG8+G8 -> 504 | I8: =AH8+H8 -> 648 | J8: =I8+AI8 -> 792 | K8: =AJ8+J8 -> 936 | L8: =AK8+K8 -> 1080 | M8: =L8+AL8 -> 1080 | N8: =AM8+M8 -> 1080 | O8: =AN8+N8 -> 1080 | P8: =O8+AO8 -> 1080 | Q8: =AP8+P8 -> 1080 | R8: =AQ8+Q8 -> 1224 | S8: =R8+AR8 -> 1366 | T8: =AS8+S8 -> 1366 | U8: =AT8+T8 -> 1366 | V8: =U8+AU8 -> 1366 | W8: =AV8+V8 -> 1438 | X8: =AW8+W8 -> 1582 | Y8: =X8+AX8 -> 1582 | Z8: =AY8+Y8 -> 1582 | AA8: =AZ8+Z8 -> 1582 | AB8: ****** | AC8: 0 | AD8: 144 | AE8: 144 | AF8: 144 | AG8: 72 | AH8: 144 | AI8: 144 | AJ8: 144 | AK8: 144 | AL8: 0 | AM8: 0 | AN8: 0 | AO8: 0 | AP8: 0 | AQ8: 144 | AR8: 142 | AS8: 0 | AT8: 0 | AU8: 0 | AV8: 72 | AW8: 144 | AX8: 0 | AY8: 0 | AZ8: 0 | BA8: =MAX(AC8:AZ8) -> 144
A9: ITO2_Line | B9: T1CF | C9: 40710 | D9: =AC9 -> 0 | E9: =AD9+D9 -> 0 | F9: =AE9+E9 -> 0 | G9: =F9+AF9 -> 0 | H9: =AG9+G9 -> 89 | I9: =AH9+H9 -> 89 | J9: =AI9+I9 -> 89 | K9: =J9+AJ9 -> 89 | L9: =AK9+K9 -> 89 | M9: =AL9+L9 -> 89 | N9: =AM9+M9 -> 89 | O9: =N9+AN9 -> 89 | P9: =AO9+O9 -> 89 | Q9: =AP9+P9 -> 89 | R9: =AQ9+Q9 -> 89 | S9: =R9+AR9 -> 89 | T9: =AS9+S9 -> 89 | U9: =AT9+T9 -> 89 | V9: =AU9+U9 -> 89 | W9: =V9+AV9 -> 89 | X9: =AW9+W9 -> 89 | Y9: =AX9+X9 -> 89 | Z9: =AY9+Y9 -> 89 | AA9: =Z9+AZ9 -> 89 | AB9: ****** | AC9: 0 | AD9: 0 | AE9: 0 | AF9: 0 | AG9: 89 | AH9: 0 | AI9: 0 | AJ9: 0 | AK9: 0 | AL9: 0 | AM9: 0 | AN9: 0 | AO9: 0 | AP9: 0 | AQ9: 0 | AR9: 0 | AS9: 0 | AT9: 0 | AU9: 0 | AV9: 0 | AW9: 0 | AX9: 0 | AY9: 0 | AZ9: 0 | BA9: =MAX(AC9:AZ9) -> 89
A10: PS_Line | B10: T1CF | C10: 40710 | D10: =AC10 -> 72 | E10: =AD10+D10 -> 144 | F10: =AE10+E10 -> 216 | G10: =F10+AF10 -> 289 | H10: =AG10+G10 -> 361 | I10: =AH10+H10 -> 433 | J10: =I10+AI10 -> 507 | K10: =AJ10+J10 -> 580 | L10: =AK10+K10 -> 656 | M10: =L10+AL10 -> 735 | N10: =AM10+M10 -> 735 | O10: =AN10+N10 -> 807 | P10: =O10+AO10 -> 901 | Q10: =AP10+P10 -> 1024 | R10: =AQ10+Q10 -> 1098 | S10: =R10+AR10 -> 1173 | T10: =AS10+S10 -> 1317 | U10: =AT10+T10 -> 1461 | V10: =U10+AU10 -> 1564 | W10: =AV10+V10 -> 1564 | X10: =AW10+W10 -> 1566 | Y10: =X10+AX10 -> 1566 | Z10: =AY10+Y10 -> 1638 | AA10: =AZ10+Z10 -> 1638 | AB10: ****** | AC10: 72 | AD10: 72 | AE10: 72 | AF10: 73 | AG10: 72 | AH10: 72 | AI10: 74 | AJ10: 73 | AK10: 76 | AL10: 79 | AM10: 0 | AN10: 72 | AO10: 94 | AP10: 123 | AQ10: 74 | AR10: 75 | AS10: 144 | AT10: 144 | AU10: 103 | AV10: 0 | AW10: 2 | AX10: 0 | AY10: 72 | AZ10: 0 | BA10: =MAX(AC10:AZ10) -> 144
A11: IS_Line | B11: T1CF | C11: 40710 | D11: =AC11 -> 0 | E11: =AD11+D11 -> 72 | F11: =AE11+E11 -> 144 | G11: =F11+AF11 -> 144 | H11: =AG11+G11 -> 216 | I11: =AH11+H11 -> 288 | J11: =AI11+I11 -> 360 | K11: =J11+AJ11 -> 360 | L11: =AK11+K11 -> 432 | M11: =AL11+L11 -> 504 | N11: =AM11+M11 -> 648 | O11: =N11+AN11 -> 720 | P11: =AO11+O11 -> 792 | Q11: =AP11+P11 -> 792 | R11: =AQ11+Q11 -> 864 | S11: =R11+AR11 -> 936 | T11: =AS11+S11 -> 1008 | U11: =AT11+T11 -> 1080 | V11: =AU11+U11 -> 1152 | W11: =V11+AV11 -> 1224 | X11: =AW11+W11 -> 1296 | Y11: =AX11+X11 -> 1368 | Z11: =AY11+Y11 -> 1440 | AA11: =Z11+AZ11 -> 1440 | AB11: ****** | AC11: 0 | AD11: 72 | AE11: 72 | AF11: 0 | AG11: 72 | AH11: 72 | AI11: 72 | AJ11: 0 | AK11: 72 | AL11: 72 | AM11: 144 | AN11: 72 | AO11: 72 | AP11: 0 | AQ11: 72 | AR11: 72 | AS11: 72 | AT11: 72 | AU11: 72 | AV11: 72 | AW11: 72 | AX11: 72 | AY11: 72 | AZ11: 0 | BA11: =MAX(AC11:AZ11) -> 144
A12: Shipping | B12: T1CF | C12: 40710 | D12: =AC12 -> 69 | E12: =AD12+D12 -> 141 | F12: =AE12+E12 -> 141 | G12: =F12+AF12 -> 285 | H12: =AG12+G12 -> 352 | I12: =AH12+H12 -> 352 | J12: =I12+AI12 -> 424 | K12: =AJ12+J12 -> 1072 | L12: =AK12+K12 -> 2063 | M12: =L12+AL12 -> 2495 | N12: =AM12+M12 -> 2495 | O12: =AN12+N12 -> 2639 | P12: =O12+AO12 -> 2639 | Q12: =AP12+P12 -> 2639 | R12: =AQ12+Q12 -> 2783 | S12: =R12+AR12 -> 2927 | T12: =AS12+S12 -> 2927 | U12: =AT12+T12 -> 2927 | V12: =U12+AU12 -> 3359 | W12: =AV12+V12 -> 3359 | X12: =AW12+W12 -> 3359 | Y12: =X12+AX12 -> 4151 | Z12: =AY12+Y12 -> 4151 | AA12: =AZ12+Z12 -> 4151 | AB12: ****** | AC12: 69 | AD12: 72 | AE12: 0 | AF12: 144 | AG12: 67 | AH12: 0 | AI12: 72 | AJ12: 648 | AK12: 991 | AL12: 432 | AM12: 0 | AN12: 144 | AO12: 0 | AP12: 0 | AQ12: 144 | AR12: 144 | AS12: 0 | AT12: 0 | AU12: 432 | AV12: 0 | AW12: 0 | AX12: 792 | AY12: 0 | AZ12: 0 | BA12: =MAX(AC12:AZ12) -> 991
A13: BM_OCLine | B13: T1CF | C13: 40710 | D13: =AC13 -> 0 | E13: =AD13+D13 -> 0 | F13: =AE13+E13 -> 0 | G13: =F13+AF13 -> 0 | H13: =AG13+G13 -> 0 | I13: =AH13+H13 -> 0 | J13: =AI13+I13 -> 0 | K13: =J13+AJ13 -> 0 | L13: =AK13+K13 -> 0 | M13: =AL13+L13 -> 0 | N13: =AM13+M13 -> 0 | O13: =N13+AN13 -> 0 | P13: =AO13+O13 -> 0 | Q13: =AP13+P13 -> 0 | R13: =AQ13+Q13 -> 0 | S13: =R13+AR13 -> 0 | T13: =AS13+S13 -> 0 | U13: =AT13+T13 -> 0 | V13: =AU13+U13 -> 0 | W13: =V13+AV13 -> 0 | X13: =AW13+W13 -> 0 | Y13: =AX13+X13 -> 0 | Z13: =AY13+Y13 -> 0 | AA13: =Z13+AZ13 -> 0 | AB13: ****** | AC13: 0 | AD13: 0 | AE13: 0 | AF13: 0 | AG13: 0 | AH13: 0 | AI13: 0 | AJ13: 0 | AK13: 0 | AL13: 0 | AM13: 0 | AN13: 0 | AO13: 0 | AP13: 0 | AQ13: 0 | AR13: 0 | AS13: 0 | AT13: 0 | AU13: 0 | AV13: 0 | AW13: 0 | AX13: 0 | AY13: 0 | AZ13: 0 | BA13: =MAX(AC13:AZ13) -> 0
A14: R_OCLine | B14: T1CF | C14: 40710 | D14: =AC14 -> 0 | E14: =AD14+D14 -> 0 | F14: =AE14+E14 -> 0 | G14: =F14+AF14 -> 0 | H14: =AG14+G14 -> 0 | I14: =AH14+H14 -> 0 | J14: =I14+AI14 -> 0 | K14: =AJ14+J14 -> 0 | L14: =AK14+K14 -> 0 | M14: =L14+AL14 -> 0 | N14: =AM14+M14 -> 0 | O14: =AN14+N14 -> 0 | P14: =O14+AO14 -> 0 | Q14: =AP14+P14 -> 0 | R14: =AQ14+Q14 -> 0 | S14: =R14+AR14 -> 0 | T14: =AS14+S14 -> 0 | U14: =AT14+T14 -> 0 | V14: =U14+AU14 -> 0 | W14: =AV14+V14 -> 0 | X14: =AW14+W14 -> 0 | Y14: =X14+AX14 -> 0 | Z14: =AY14+Y14 -> 0 | AA14: =AZ14+Z14 -> 0 | AB14: ****** | AC14: 0 | AD14: 0 | AE14: 0 | AF14: 0 | AG14: 0 | AH14: 0 | AI14: 0 | AJ14: 0 | AK14: 0 | AL14: 0 | AM14: 0 | AN14: 0 | AO14: 0 | AP14: 0 | AQ14: 0 | AR14: 0 | AS14: 0 | AT14: 0 | AU14: 0 | AV14: 0 | AW14: 0 | AX14: 0 | AY14: 0 | AZ14: 0 | BA14: =MAX(AC14:AZ14) -> 0
A15: B_OCLine | B15: T1CF | C15: 40710 | D15: =AC15 -> 0 | E15: =AD15+D15 -> 0 | F15: =AE15+E15 -> 0 | G15: =F15+AF15 -> 0 | H15: =AG15+G15 -> 0 | I15: =AH15+H15 -> 0 | J15: =AI15+I15 -> 0 | K15: =J15+AJ15 -> 0 | L15: =AK15+K15 -> 0 | M15: =AL15+L15 -> 0 | N15: =AM15+M15 -> 0 | O15: =N15+AN15 -> 0 | P15: =AO15+O15 -> 0 | Q15: =AP15+P15 -> 0 | R15: =AQ15+Q15 -> 0 | S15: =R15+AR15 -> 0 | T15: =AS15+S15 -> 0 | U15: =AT15+T15 -> 0 | V15: =AU15+U15 -> 0 | W15: =V15+AV15 -> 0 | X15: =AW15+W15 -> 0 | Y15: =AX15+X15 -> 0 | Z15: =AY15+Y15 -> 0 | AA15: =Z15+AZ15 -> 0 | AB15: ****** | AC15: 0 | AD15: 0 | AE15: 0 | AF15: 0 | AG15: 0 | AH15: 0 | AI15: 0 | AJ15: 0 | AK15: 0 | AL15: 0 | AM15: 0 | AN15: 0 | AO15: 0 | AP15: 0 | AQ15: 0 | AR15: 0 | AS15: 0 | AT15: 0 | AU15: 0 | AV15: 0 | AW15: 0 | AX15: 0 | AY15: 0 | AZ15: 0 | BA15: =MAX(AC15:AZ15) -> 0
A16: G_OCLine | B16: T1CF | C16: 40710 | D16: =AC16 -> 0 | E16: =AD16+D16 -> 0 | F16: =AE16+E16 -> 0 | G16: =F16+AF16 -> 0 | H16: =AG16+G16 -> 0 | I16: =AH16+H16 -> 0 | J16: =I16+AI16 -> 0 | K16: =AJ16+J16 -> 0 | L16: =AK16+K16 -> 0 | M16: =L16+AL16 -> 0 | N16: =AM16+M16 -> 0 | O16: =AN16+N16 -> 0 | P16: =O16+AO16 -> 0 | Q16: =AP16+P16 -> 0 | R16: =AQ16+Q16 -> 0 | S16: =R16+AR16 -> 0 | T16: =AS16+S16 -> 0 | U16: =AT16+T16 -> 0 | V16: =U16+AU16 -> 0 | W16: =AV16+V16 -> 0 | X16: =AW16+W16 -> 0 | Y16: =X16+AX16 -> 0 | Z16: =AY16+Y16 -> 0 | AA16: =AZ16+Z16 -> 0 | AB16: ****** | AC16: 0 | AD16: 0 | AE16: 0 | AF16: 0 | AG16: 0 | AH16: 0 | AI16: 0 | AJ16: 0 | AK16: 0 | AL16: 0 | AM16: 0 | AN16: 0 | AO16: 0 | AP16: 0 | AQ16: 0 | AR16: 0 | AS16: 0 | AT16: 0 | AU16: 0 | AV16: 0 | AW16: 0 | AX16: 0 | AY16: 0 | AZ16: 0 | BA16: =MAX(AC16:AZ16) -> 0
A17: PS_OCLine | B17: T1CF | C17: 40710 | D17: =AC17 -> 0 | E17: =AD17+D17 -> 0 | F17: =AE17+E17 -> 0 | G17: =F17+AF17 -> 0 | H17: =AG17+G17 -> 0 | I17: =AH17+H17 -> 0 | J17: =AI17+I17 -> 0 | K17: =J17+AJ17 -> 0 | L17: =AK17+K17 -> 0 | M17: =AL17+L17 -> 0 | N17: =AM17+M17 -> 0 | O17: =N17+AN17 -> 0 | P17: =AO17+O17 -> 0 | Q17: =AP17+P17 -> 0 | R17: =AQ17+Q17 -> 0 | S17: =R17+AR17 -> 0 | T17: =AS17+S17 -> 0 | U17: =AT17+T17 -> 0 | V17: =AU17+U17 -> 0 | W17: =V17+AV17 -> 0 | X17: =AW17+W17 -> 0 | Y17: =AX17+X17 -> 0 | Z17: =AY17+Y17 -> 0 | AA17: =Z17+AZ17 -> 0 | AB17: ****** | AC17: 0 | AD17: 0 | AE17: 0 | AF17: 0 | AG17: 0 | AH17: 0 | AI17: 0 | AJ17: 0 | AK17: 0 | AL17: 0 | AM17: 0 | AN17: 0 | AO17: 0 | AP17: 0 | AQ17: 0 | AR17: 0 | AS17: 0 | AT17: 0 | AU17: 0 | AV17: 0 | AW17: 0 | AX17: 0 | AY17: 0 | AZ17: 0 | BA17: =MAX(AC17:AZ17) -> 0
A18: I3_IF | B18: T1CF | C18: 40710 | D18: =AC18 -> 0 | E18: =AD18+D18 -> 0 | F18: =AE18+E18 -> 0 | G18: =F18+AF18 -> 0 | H18: =AG18+G18 -> 0 | I18: =AH18+H18 -> 0 | J18: =I18+AI18 -> 0 | K18: =AJ18+J18 -> 0 | L18: =AK18+K18 -> 0 | M18: =L18+AL18 -> 0 | N18: =AM18+M18 -> 0 | O18: =AN18+N18 -> 0 | P18: =O18+AO18 -> 0 | Q18: =AP18+P18 -> 0 | R18: =AQ18+Q18 -> 0 | S18: =R18+AR18 -> 4 | T18: =AS18+S18 -> 4 | U18: =AT18+T18 -> 21 | V18: =U18+AU18 -> 21 | W18: =AV18+V18 -> 21 | X18: =AW18+W18 -> 21 | Y18: =X18+AX18 -> 22 | Z18: =AY18+Y18 -> 22 | AA18: =AZ18+Z18 -> 22 | AB18: ****** | AC18: 0 | AD18: 0 | AE18: 0 | AF18: 0 | AG18: 0 | AH18: 0 | AI18: 0 | AJ18: 0 | AK18: 0 | AL18: 0 | AM18: 0 | AN18: 0 | AO18: 0 | AP18: 0 | AQ18: 0 | AR18: 4 | AS18: 0 | AT18: 17 | AU18: 0 | AV18: 0 | AW18: 0 | AX18: 1 | AY18: 0 | AZ18: 0 | BA18: =MAX(AC18:AZ18) -> 17
A19: I3_IS | B19: T1CF | C19: 40710 | D19: =AC19 -> 0 | E19: =AD19+D19 -> 0 | F19: =AE19+E19 -> 0 | G19: =F19+AF19 -> 72 | H19: =AG19+G19 -> 144 | I19: =AH19+H19 -> 144 | J19: =AI19+I19 -> 216 | K19: =J19+AJ19 -> 216 | L19: =AK19+K19 -> 288 | M19: =AL19+L19 -> 360 | N19: =AM19+M19 -> 432 | O19: =N19+AN19 -> 432 | P19: =AO19+O19 -> 504 | Q19: =AP19+P19 -> 711 | R19: =AQ19+Q19 -> 711 | S19: =R19+AR19 -> 712 | T19: =AS19+S19 -> 712 | U19: =AT19+T19 -> 712 | V19: =AU19+U19 -> 712 | W19: =V19+AV19 -> 712 | X19: =AW19+W19 -> 712 | Y19: =AX19+X19 -> 712 | Z19: =AY19+Y19 -> 712 | AA19: =Z19+AZ19 -> 712 | AB19: ****** | AC19: 0 | AD19: 0 | AE19: 0 | AF19: 72 | AG19: 72 | AH19: 0 | AI19: 72 | AJ19: 0 | AK19: 72 | AL19: 72 | AM19: 72 | AN19: 0 | AO19: 72 | AP19: 207 | AQ19: 0 | AR19: 1 | AS19: 0 | AT19: 0 | AU19: 0 | AV19: 0 | AW19: 0 | AX19: 0 | AY19: 0 | AZ19: 0 | BA19: =MAX(AC19:AZ19) -> 207